{
  "schemaVersion": 1,
  "deploymentName": "woml-release-candidate-container",
  "statePath": "/app/data/state.sqlite",
  "public": { "host": "0.0.0.0", "port": 3000 },
  "admin": { "host": "127.0.0.1", "port": 3001 },
  "logging": { "format": "json", "level": "info", "directory": "/app/logs" },
  "workers": 1,
  "shutdownTimeoutMs": 10000,
  "observability": { "health": true, "metrics": true }
}
